"Agency","Component","Fiscal Year","Number Granted","Number Denied","Median Number of Days to Adjudicate","Average Number of Days to Adjudicate","Number Adjudicated Within Ten Calendar Days"
"Corporation for National and Community Service (operating as AmeriCorps)","Agency Overall","2024","0","0","N/A","N/A","0"
"Department of Justice","Agency Overall","2024","496","4068","2","12.73","3922"
"American Battle Monuments Commission","Agency Overall","2024","0","0","N/A","N/A","0"
"Federal Energy Regulatory Commission","Agency Overall","2024","0","0","N/A","N/A","0"
"Office of Special Counsel","Agency Overall","2024","4","13","3","19.24","14"
"Commission of Fine Arts","Agency Overall","2024","0","0","N/A","N/A","0"
"United States Copyright Office","Agency Overall","2024","0","0","N/A","N/A","0"
"Office of Science and Technology Policy","Agency Overall","2024","0","1","10","10","1"
"Federal Open Market Committee","Agency Overall","2024","0","0","N/A","N/A","0"
"U.S. Commission for the Preservation of America’s Heritage Abroad","Agency Overall","2024","0","0","N/A","N/A","0"
"U.S. Commission on Civil Rights","Agency Overall","2024","0","0","N/A","N/A","0"
"Council of the Inspectors General on Integrity and Efficiency","Agency Overall","2024","0","0","N/A","N/A","0"
"Office of the National Cyber Director","Agency Overall","2024","0","0","N/A","N/A","0"
"Department of Health and Human Services","Agency Overall","2024","75","972","3.36","17.52","952"
"Morris K. Udall and Stewart L. Udall Foundation","Agency Overall","2024","0","0","0","0","0"
"Surface Transportation Board","Agency Overall","2024","0","0","N/A","N/A","0"
"Department of Energy","Agency Overall","2024","10","67","7.00","19.26","48"
"Consumer Financial Protection Bureau","Agency Overall","2024","0","19","1","2.16","18"
"Federal Labor Relations Authority","Agency Overall","2024","1","3","5","7","4"
"U.S. Election Assistance Commission","Agency Overall","2024","0","4","9","9","4"
"Federal Communications Commission","Agency Overall","2024","46","72","3","5.68","84"
"Federal Deposit Insurance Corporation","Agency Overall","2024","28","28","7.00","9.79","35"
"Office of Navajo and Hopi Indian Relocation","Agency Overall","2024","0","0","N/A","N/A","0"
"National Credit Union Administration","Agency Overall","2024","7","6","2","5","11"
"National Science Foundation","Agency Overall","2024","3","0","380","414.66","0"
"Millennium Challenge Corporation","Agency Overall","2024","0","0","N/A","N/A","0"
"Office of National Drug Control Policy","Agency Overall","2024","0","0","N/A","N/A","0"
"U.S. Interagency Council on Homelessness","Agency Overall","2024","0","0","N/A","N/A","0"
"Office of Pandemic Preparedness and Response Policy","Agency Overall","2024","0","0","N/A","N/A","0"
"United States Trade and Development Agency","Agency Overall","2024","0","0","N/A","N/A","0"
"Selective Service System","Agency Overall","2024","0","0","N/A","N/A","0"
"Court Services and Offender Supervision Agency","Agency Overall","2024","0","31","1","1","31"
"Nuclear Regulatory Commission","Agency Overall","2024","2","9","1","1","11"
"Federal Reserve System","Agency Overall","2024","14","54","7","6","68"
"National Labor Relations Board","Agency Overall","2024","303","209","1","3","472"
"U.S. Agency for International Development","Agency Overall","2024","1","45","0","3.59","43"
"Department of Transportation","Agency Overall","2024","16","301","15","84.95","139"
"Social Security Advisory Board","Agency Overall","2024","0","0","N/A","N/A","0"
"Institute of Museum and Library Services","Agency Overall","2024","0","0","N/A","N/A","0"
"Federal Maritime Commission","Agency Overall","2024","0","0","N/A","N/A","0"
"Harry S. Truman Scholarship Foundation","Agency Overall","2024","0","0","N/A","N/A","0"
"Neighborhood Reinvestment Corporation","Agency Overall","2024","0","0","N/A","N/A","0"
"Department of Defense","Agency Overall","2024","602","1362","3","30.25","1599"
"Federal Mediation and Conciliation Service","Agency Overall","2024","0","7","9","8.14","5"
"Advisory Council on Historic Preservation","Agency Overall","2024","0","0","N/A","N/A","0"
"Federal Financial Institutions Examination Council","Agency Overall","2024","0","0","N/A","N/A","0"
"Securities and Exchange Commission","Agency Overall","2024","0","353","3","5.09","336"
"Office of the Intellectual Property Enforcement Coordinator","Agency Overall","2024","0","0","N/A","N/A","0"
"Equal Employment Opportunity Commission","Agency Overall","2024","0","0","N/A","N/A","0"
"Administrative Conference of the United States","Agency Overall","2024","0","0","N/A","N/A","0"
"Appraisal Subcommittee","Agency Overall","2024","0","1","10","10","1"
"Office of the Director of National Intelligence","Agency Overall","2024","4","12","5","7.5","10"
"Federal Trade Commission","Agency Overall","2024","25","101","2","9.35","102"
"Department of Commerce","Agency Overall","2024","22","128","1","9.8","122"
"Department of Housing and Urban Development","Agency Overall","2024","35","42","2","9.05","57"
"Gulf Coast Ecosystem Restoration Council","Agency Overall","2024","0","0","N/A","N/A","0"
"Pension Benefit Guaranty Corporation","Agency Overall","2024","0","117","5","6.52","97"
"United States Access Board","Agency Overall","2024","0","0","N/A","N/A","0"
"Department of the Treasury","Agency Overall","2024","55","439","2.00","6.80","392"
"Department of Homeland Security","Agency Overall","2024","418","54877","11","103","54404"
"Committee for Purchase from People Who Are Blind or Severely Disabled","Agency Overall","2024","0","0","N/A","N/A","0"
"United States International Trade Commission","Agency Overall","2024","0","0","N/A","N/A","0"
"Environmental Protection Agency","Agency Overall","2024","15","293","1","4.13","284"
"Marine Mammal Commission","Agency Overall","2024","0","0","N/A","N/A","0"
"Department of Labor","Agency Overall","2024","76","243","8.00","33.55","176"
"U.S. Nuclear Waste Technical Review Board","Agency Overall","2024","0","0","N/A","N/A","0"
"United States Postal Service","Agency Overall","2024","3","155","1","5.51","150"
"Occupational Safety and Health Review Commission","Agency Overall","2024","0","0","N/A","N/A","0"
"Tennessee Valley Authority","Agency Overall","2024","0","1","10","10","1"
"Farm Credit Administration","Agency Overall","2024","0","2","15","22","0"
"National Railroad Passenger Corporation","Agency Overall","2024","44","157","2","37.88","136"
"Office of Personnel Management","Agency Overall","2024","0","37","<1","0.54","37"
"National Endowment for the Humanities","Agency Overall","2024","0","4","1","1.75","4"
"Legal Services Corporation","Agency Overall","2024","0","0","N/A","N/A","0"
"Inter-American Foundation","Agency Overall","2024","0","0","N/A","N/A","0"
"Federal Election Commission","Agency Overall","2024","0","0","N/A","N/A","0"
"Denali Commission","Agency Overall","2024","0","0","N/A","N/A","0"
"James Madison Memorial Fellowship Foundation","Agency Overall","2024","0","0","N/A","N/A","0"
"Consumer Product Safety Commission","Agency Overall","2024","2","55","5","17.56","45"
"Presidio Trust","Agency Overall","2024","0","0","N/A","N/A","0"
"Postal Regulatory Commission","Agency Overall","2024","0","0","N/A","N/A","0"
"U.S. Department of State","Agency Overall","2024","213","790","22","31.5","138"
"Federal Housing Finance Agency","Agency Overall","2024","0","8","2","6.62","6"
"Small Business Administration","Agency Overall","2024","26","60","14","21.95","36"
"Federal Mine Safety and Health Review Commission","Agency Overall","2024","0","0","N/A","N/A","0"
"Office of Government Ethics","Agency Overall","2024","4","0","3.5","5","3"
"Office of the Special Inspector General for Afghanistan Reconstruction","Agency Overall","2024","0","1","10","10","1"
"National Transportation Safety Board","Agency Overall","2024","0","20","1","6.05","19"
"Department of Veterans Affairs","Agency Overall","2024","71","361","4.00","17.68","301"
"United States Institute of Peace","Agency Overall","2024","0","0","N/A","N/A","0"
"National Mediation Board","Agency Overall","2024","0","0","N/A","N/A","0"
"Chemical Safety and Hazard Investigation Board","Agency Overall","2024","1","1","1","1","2"
"National Archives and Records Administration","Agency Overall","2024","1","83","7","10","78"
"Department of Education","Agency Overall","2024","1","175","<1","12.48","162"
"National Endowment for the Arts","Agency Overall","2024","0","7","7","7","7"
"National Council on Disability","Agency Overall","2024","0","0","N/A","N/A","0"
"National Aeronautics and Space Administration","Agency Overall","2024","2","34","1","24.2","33"
"Export-Import Bank of the U.S.","Agency Overall","2024","0","2","1","1","2"
"Privacy and Civil Liberties Oversight Board","Agency Overall","2024","1","4","15","12","1"
"Defense Nuclear Facilities Safety Board","Agency Overall","2024","0","0","N/A","N/A","0"
"Farm Credit System Insurance Corporation","Agency Overall","2024","0","0","N/A","N/A","0"
"United States International Boundary and Water Commission","Agency Overall","2024","0","2","2","2","2"
"Office of Management and Budget","Agency Overall","2024","7","13","7","11","17"
"National Capital Planning Commission","Agency Overall","2024","3","0","2","3.33","3"
"Central Intelligence Agency","Agency Overall","2024","1","105","3","7.7","80"
"Merit Systems Protection Board","Agency Overall","2024","0","23","0","3.3","21"
"Council on Environmental Quality","Agency Overall","2024","0","12","2","7.92","9"
"Commodity Futures Trading Commission","Agency Overall","2024","1","4","8","5.6","5"
"National Indian Gaming Commission","Agency Overall","2024","0","5","8","5","5"
"United States African Development Foundation","Agency Overall","2024","0","0","N/A","N/A","0"
"Office of the United States Trade Representative","Agency Overall","2024","0","11","6","4","11"
"Social Security Administration","Agency Overall","2024","18","386","11","16","194"
"Armed Forces Retirement Home","Agency Overall","2024","0","0","N/A","N/A","0"
"General Services Administration","Agency Overall","2024","3","132","5","14.45","104"
"Department of the Interior","Agency Overall","2024","69","628","6","59.58","429"
"Peace Corps","Agency Overall","2024","7","0","1","4.71","6"
"Department of Agriculture","Agency Overall","2024","60","247","4","17.81","255"
"U.S. Agency for Global Media","Agency Overall","2024","0","1","8","8","1"
"Federal Permitting Improvement Steering Council","Agency Overall","2024","0","0","N/A","N/A","0"
"U.S. Railroad Retirement Board","Agency Overall","2024","0","0","N/A","N/A","0"
"Federal Retirement Thrift Investment Board","Agency Overall","2024","0","0","N/A","N/A","0"
"U.S. International Development Finance Corporation","Agency Overall","2024","0","1","10","10","1"
"All agencies","Agency Overall","2024","2796","67404","N/A","N/A","65747"