"Agency","Component","Fiscal Year","Number of Full Grants","Number of Partial Grants/Partial Denials","Number of Full Denials Based on Exemptions","No Records","All Records Referred to Another Component or Agency","Request Withdrawn","Fee-Related Reason","Records Not Reasonably Described","Improper FOIA Request for Other Reason","Not Agency Record","Duplicate Request","Other*","Total"
"Corporation for National and Community Service (operating as AmeriCorps)","Agency Overall","2024","18","17","4","14","0","7","0","0","4","0","3","8","75"
"Department of Justice","Agency Overall","2024","64557","13561","4667","30504","339","4643","273","1035","30756","339","3462","3044","157180"
"American Battle Monuments Commission","Agency Overall","2024","13","0","0","19","0","0","0","6","0","0","0","0","38"
"Federal Energy Regulatory Commission","Agency Overall","2024","28","74","9","31","1","11","0","1","0","0","0","2","157"
"Office of Special Counsel","Agency Overall","2024","10","61","15","47","2","6","0","1","11","10","5","2","170"
"Commission of Fine Arts","Agency Overall","2024","19","0","0","70","0","0","0","2","0","0","0","0","91"
"United States Copyright Office","Agency Overall","2024","4","2","0","26","13","7","0","7","0","4","0","9","72"
"Office of Science and Technology Policy","Agency Overall","2024","3","141","0","23","1","1","0","7","0","0","2","0","178"
"Federal Open Market Committee","Agency Overall","2024","8","4","2","21","13","3","0","4","6","3","0","0","64"
"U.S. Commission for the Preservation of America’s Heritage Abroad","Agency Overall","2024","2","2","0","16","0","0","0","0","0","0","0","0","20"
"U.S. Commission on Civil Rights","Agency Overall","2024","36","2","0","16","1","3","0","26","0","0","0","0","84"
"Council of the Inspectors General on Integrity and Efficiency","Agency Overall","2024","8","0","0","50","0","0","0","6","32","0","4","0","100"
"Office of the National Cyber Director","Agency Overall","2024","1","10","0","127","2","0","0","15","0","0","0","0","155"
"Department of Health and Human Services","Agency Overall","2024","15284","4096","8453","5257","432","3570","2009","802","5160","1114","2728","366","49271"
"Morris K. Udall and Stewart L. Udall Foundation","Agency Overall","2024","8","7","1","36","0","0","0","4","0","0","0","0","56"
"Surface Transportation Board","Agency Overall","2024","18","6","0","69","0","3","2","0","0","0","1","0","99"
"Department of Energy","Agency Overall","2024","422","328","35","424","416","125","26","98","64","103","560","649","3250"
"Consumer Financial Protection Bureau","Agency Overall","2024","67","102","50","49","3","75","0","23","55","272","138","0","834"
"Federal Labor Relations Authority","Agency Overall","2024","9","62","5","107","1","0","0","7","7","1","2","3","204"
"U.S. Election Assistance Commission","Agency Overall","2024","8","8","0","26","0","0","0","0","0","0","0","0","42"
"Federal Communications Commission","Agency Overall","2024","106","211","14","129","1","101","6","1","13","119","20","263","984"
"Federal Deposit Insurance Corporation","Agency Overall","2024","69","76","47","71","1","15","8","394","54","126","12","0","873"
"Office of Navajo and Hopi Indian Relocation","Agency Overall","2024","38","0","0","36","0","0","0","0","0","0","0","0","74"
"National Credit Union Administration","Agency Overall","2024","71","57","12","107","0","12","10","19","19","47","30","0","384"
"National Science Foundation","Agency Overall","2024","31","61","9","48","12","204","0","1","5","0","3","0","374"
"Millennium Challenge Corporation","Agency Overall","2024","28","2","5","19","0","0","0","4","0","0","0","0","58"
"Office of National Drug Control Policy","Agency Overall","2024","7","22","0","16","0","1","2","0","0","1","0","0","49"
"U.S. Interagency Council on Homelessness","Agency Overall","2024","17","0","0","0","0","0","0","0","0","0","0","0","17"
"Office of Pandemic Preparedness and Response Policy","Agency Overall","2024","0","0","0","0","0","0","0","0","0","0","0","0","0"
"United States Trade and Development Agency","Agency Overall","2024","23","19","2","33","0","0","0","0","6","0","0","0","83"
"Selective Service System","Agency Overall","2024","71","1","1","0","0","0","0","0","0","0","0","0","73"
"Court Services and Offender Supervision Agency","Agency Overall","2024","32","184","7","264","0","10","4","4","87","2","2","0","596"
"Nuclear Regulatory Commission","Agency Overall","2024","67","55","6","242","0","34","22","12","10","7","6","0","461"
"Federal Reserve System","Agency Overall","2024","259","76","64","170","1","20","3","18","139","295","21","6","1072"
"National Labor Relations Board","Agency Overall","2024","341","1463","48","89","0","298","139","96","45","0","69","0","2588"
"U.S. Agency for International Development","Agency Overall","2024","38","91","16","68","1","83","14","3","3","42","326","3","688"
"Department of Transportation","Agency Overall","2024","4457","6847","223","2420","199","896","46","137","56","212","460","127","16080"
"Social Security Advisory Board","Agency Overall","2024","0","1","0","42","1","0","0","0","0","0","0","0","44"
"Institute of Museum and Library Services","Agency Overall","2024","5","14","0","1","0","2","0","73","77","4","0","0","176"
"Federal Maritime Commission","Agency Overall","2024","15","7","8","39","1","5","0","0","0","0","0","0","75"
"Harry S. Truman Scholarship Foundation","Agency Overall","2024","3","2","0","18","0","0","0","0","0","0","0","0","23"
"Neighborhood Reinvestment Corporation","Agency Overall","2024","7","6","1","28","0","0","0","5","0","0","1","0","48"
"Department of Defense","Agency Overall","2024","13175","16765","2938","6543","2147","3024","463","1511","3194","1415","3361","3126","57662"
"Federal Mediation and Conciliation Service","Agency Overall","2024","20","23","5","35","0","11","0","0","0","0","0","0","94"
"Advisory Council on Historic Preservation","Agency Overall","2024","33","0","0","0","0","0","0","0","0","0","0","0","33"
"Federal Financial Institutions Examination Council","Agency Overall","2024","5","1","0","41","1","0","0","0","0","0","0","0","48"
"Securities and Exchange Commission","Agency Overall","2024","1530","734","804","6320","88","939","4","70","99","215","182","0","10985"
"Office of the Intellectual Property Enforcement Coordinator","Agency Overall","2024","5","1","0","37","0","0","0","0","0","0","0","0","43"
"Equal Employment Opportunity Commission","Agency Overall","2024","419","12128","1547","964","23","112","19","308","1501","4","1252","57","18334"
"Administrative Conference of the United States","Agency Overall","2024","11","6","0","128","0","0","0","0","0","0","0","0","145"
"Appraisal Subcommittee","Agency Overall","2024","5","6","2","24","0","0","0","6","0","0","1","0","44"
"Office of the Director of National Intelligence","Agency Overall","2024","13","174","71","94","7","2","0","0","1","7","9","12","390"
"Federal Trade Commission","Agency Overall","2024","414","608","217","166","7","85","9","53","234","23","19","84","1919"
"Department of Commerce","Agency Overall","2024","390","339","180","471","34","174","83","116","120","39","128","1336","3410"
"Department of Housing and Urban Development","Agency Overall","2024","335","509","68","449","12","324","21","28","80","47","1188","41","3102"
"Gulf Coast Ecosystem Restoration Council","Agency Overall","2024","11","0","0","0","0","0","0","0","0","0","0","0","11"
"Pension Benefit Guaranty Corporation","Agency Overall","2024","2078","327","40","209","0","56","6","6","9","0","40","2","2773"
"United States Access Board","Agency Overall","2024","9","6","2","24","0","0","0","0","0","0","0","0","41"
"Department of the Treasury","Agency Overall","2024","2683","2126","491","1085","157","747","55","247","2956","303","1766","71","12687"
"Department of Homeland Security","Agency Overall","2024","39712","365330","18055","294914","25644","6549","118","2359","80912","28303","31550","1493","894939"
"Committee for Purchase from People Who Are Blind or Severely Disabled","Agency Overall","2024","4","4","1","19","0","1","0","18","0","0","0","0","47"
"United States International Trade Commission","Agency Overall","2024","3","31","13","111","5","4","0","2","4","0","0","0","173"
"Environmental Protection Agency","Agency Overall","2024","2154","981","71","1087","7","501","49","237","991","60","964","32","7134"
"Marine Mammal Commission","Agency Overall","2024","13","2","0","52","1","0","0","2","0","0","0","0","70"
"Department of Labor","Agency Overall","2024","1973","4601","1777","3245","280","873","401","379","303","226","798","0","14856"
"U.S. Nuclear Waste Technical Review Board","Agency Overall","2024","1","0","0","0","0","0","0","0","0","0","0","0","1"
"United States Postal Service","Agency Overall","2024","454","707","636","652","542","102","44","89","558","304","108","7","4203"
"Occupational Safety and Health Review Commission","Agency Overall","2024","26","27","1","39","0","141","0","0","0","0","0","1","235"
"Tennessee Valley Authority","Agency Overall","2024","57","80","7","38","1","4","49","3","0","1","24","0","264"
"Farm Credit Administration","Agency Overall","2024","21","18","0","30","0","0","4","2","0","0","0","0","75"
"National Railroad Passenger Corporation","Agency Overall","2024","274","178","111","118","17","76","4","50","11","9","62","0","910"
"Office of Personnel Management","Agency Overall","2024","103","122","20","85","9","73","8","30","76","146","111","0","783"
"National Endowment for the Humanities","Agency Overall","2024","8","30","1","15","0","1","0","1","6","0","0","0","62"
"Legal Services Corporation","Agency Overall","2024","7","9","1","37","0","2","0","0","0","0","0","0","56"
"Inter-American Foundation","Agency Overall","2024","4","6","0","27","0","0","0","10","0","0","1","0","48"
"Federal Election Commission","Agency Overall","2024","107","58","17","130","0","2","0","2","0","2","0","0","318"
"Denali Commission","Agency Overall","2024","34","0","0","0","0","0","0","0","0","0","0","0","34"
"James Madison Memorial Fellowship Foundation","Agency Overall","2024","0","0","0","15","0","0","0","0","0","0","0","0","15"
"Consumer Product Safety Commission","Agency Overall","2024","136","168","89","154","26","15","1","20","22","42","14","14","701"
"Presidio Trust","Agency Overall","2024","5","10","0","14","0","16","0","0","0","0","0","1","46"
"Postal Regulatory Commission","Agency Overall","2024","13","4","0","89","2","0","1","0","0","0","0","107","216"
"U.S. Department of State","Agency Overall","2024","379","5459","1503","2796","64","4452","1","327","1978","306","3510","0","20775"
"Federal Housing Finance Agency","Agency Overall","2024","25","54","1","72","0","1","0","4","2","0","1","0","160"
"Small Business Administration","Agency Overall","2024","2758","814","52","295","2","353","8","2654","36","15","105","0","7092"
"Federal Mine Safety and Health Review Commission","Agency Overall","2024","31","20","0","36","0","5","0","1","3","0","2","0","98"
"Office of Government Ethics","Agency Overall","2024","31","34","2","63","0","2","0","0","0","0","1","0","133"
"Office of the Special Inspector General for Afghanistan Reconstruction","Agency Overall","2024","5","4","1","30","0","8","0","2","0","0","1","0","51"
"National Transportation Safety Board","Agency Overall","2024","23","67","154","189","1","19","0","5","75","0","28","0","561"
"Department of Veterans Affairs","Agency Overall","2024","3562","100073","3991","1486","250","416","325","2292","1466","159","1406","4027","119453"
"United States Institute of Peace","Agency Overall","2024","11","2","1","0","1","0","0","5","1","0","0","0","21"
"National Mediation Board","Agency Overall","2024","15","3","5","42","0","0","0","3","0","0","0","0","68"
"Chemical Safety and Hazard Investigation Board","Agency Overall","2024","14","24","2","70","0","10","0","88","0","0","23","30","261"
"National Archives and Records Administration","Agency Overall","2024","1082","14401","42","1767","569","214","30","313","552","30","434","4459","23893"
"Department of Education","Agency Overall","2024","338","1415","108","333","6","403","10","94","0","330","81","1","3119"
"National Endowment for the Arts","Agency Overall","2024","7","32","2","99","0","0","0","6","7","1","1","0","155"
"National Council on Disability","Agency Overall","2024","6","4","0","12","0","0","0","0","0","0","0","1","23"
"National Aeronautics and Space Administration","Agency Overall","2024","122","247","45","207","23","49","33","188","19","32","405","89","1459"
"Export-Import Bank of the U.S.","Agency Overall","2024","27","32","9","76","1","0","1","12","0","0","0","1","159"
"Privacy and Civil Liberties Oversight Board","Agency Overall","2024","3","10","1","12","0","1","0","29","0","13","0","0","69"
"Defense Nuclear Facilities Safety Board","Agency Overall","2024","2","3","0","11","0","3","0","0","25","5","3","0","52"
"Farm Credit System Insurance Corporation","Agency Overall","2024","12","10","0","31","0","0","0","0","0","0","0","0","53"
"United States International Boundary and Water Commission","Agency Overall","2024","8","6","0","11","0","0","0","0","0","0","0","0","25"
"Office of Management and Budget","Agency Overall","2024","86","67","4","187","3","50","0","16","1","73","6","0","493"
"National Capital Planning Commission","Agency Overall","2024","5","2","0","34","0","0","0","0","0","0","0","0","41"
"Central Intelligence Agency","Agency Overall","2024","136","79","767","440","11","14","1","543","478","0","88","46","2603"
"Merit Systems Protection Board","Agency Overall","2024","47","44","3","33","0","4","0","38","2","0","13","0","184"
"Council on Environmental Quality","Agency Overall","2024","22","19","2","63","0","32","0","14","11","33","1","151","348"
"Commodity Futures Trading Commission","Agency Overall","2024","42","53","20","51","2","4","0","20","92","17","115","14","430"
"National Indian Gaming Commission","Agency Overall","2024","19","11","1","50","0","1","0","0","1","0","0","0","83"
"United States African Development Foundation","Agency Overall","2024","1","0","0","6","0","0","0","0","0","0","0","0","7"
"Office of the United States Trade Representative","Agency Overall","2024","21","59","2","28","1","0","0","0","0","1","0","0","112"
"Social Security Administration","Agency Overall","2024","5470","2083","1970","1111","130","26","290","114","80","11","69","0","11354"
"Armed Forces Retirement Home","Agency Overall","2024","18","4","14","0","0","0","0","0","0","0","0","0","36"
"General Services Administration","Agency Overall","2024","204","343","13","356","6","174","84","157","34","125","58","78","1632"
"Department of the Interior","Agency Overall","2024","1665","1659","196","1701","93","608","111","205","208","111","304","1565","8426"
"Peace Corps","Agency Overall","2024","22","71","4","187","5","2","0","8","17","1","4","10","331"
"Department of Agriculture","Agency Overall","2024","12803","2440","163","2730","219","474","46","154","743","93","1189","59","21113"
"U.S. Agency for Global Media","Agency Overall","2024","28","58","4","89","0","3","0","5","0","1","3","0","191"
"Federal Permitting Improvement Steering Council","Agency Overall","2024","5","11","0","31","0","1","0","2","0","2","0","0","52"
"U.S. Railroad Retirement Board","Agency Overall","2024","29","5","19","64","1","0","0","3","0","0","0","0","121"
"Federal Retirement Thrift Investment Board","Agency Overall","2024","32","20","2","26","2","10","0","0","19","0","5","0","116"
"U.S. International Development Finance Corporation","Agency Overall","2024","5","27","0","7","0","1","0","4","1","0","0","0","45"
"All agencies","Agency Overall","2024","181574","563566","49972","373065","31841","31309","4843","15666","133537","35206","57289","21397","1499265"